{
  "name": "pyramid16",
  "description": "16-unit pyramid container for testing",
  "lattice_type": "fcc",
  "coordinates": [
    [0, 0, 0], [1, 0, 0], [2, 0, 0], [3, 0, 0],
    [0, 1, 0], [1, 1, 0], [2, 1, 0], [3, 1, 0],
    [0, 2, 0], [1, 2, 0], [2, 2, 0], [3, 2, 0],
    [1, 1, 1], [2, 1, 1], [1, 2, 1], [2, 2, 1]
  ],
  "metadata": {
    "volume": 16,
    "bounding_box": {
      "min": [0, 0, 0],
      "max": [3, 2, 1]
    },
    "created_at": "2025-01-07T12:00:00Z",
    "created_by": "test_generator",
    "shape_type": "pyramid"
  }
}
